🚀 Starting reward vs correctness discrepancy analysis
================================================================================

 Analyzing Problem 86
==================================================
📂 Loading 100 files for problem 86
  Loaded 20/100 files...
  Loaded 40/100 files...
  Loaded 60/100 files...
  Loaded 80/100 files...
  Loaded 100/100 files...
✅ Loaded 100000 total trajectories for problem 86
🔄 Processing 100000 trajectories...
Analyzing trajectories:   0%|          | 0/100000 [00:00<?, ?it/s]Analyzing trajectories:  14%|█▁        | 14396/100000 [00:00<00:00, 143944.35it/s]Analyzing trajectories:  30%|███       | 30191/100000 [00:00<00:00, 152173.93it/s]Analyzing trajectories:  46%|████▋     | 46412/100000 [00:00<00:00, 156749.09it/s]Analyzing trajectories:  62%|██████▁   | 62087/100000 [00:00<00:00, 152908.39it/s]Analyzing trajectories:  77%|███████▋  | 77392/100000 [00:00<00:00, 150913.57it/s]Analyzing trajectories:  93%|█████████▁| 93308/100000 [00:00<00:00, 153657.10it/s]Analyzing trajectories: 100%|██████████| 100000/100000 [00:00<00:00, 153367.40it/s]

 Analyzing Problem 139
==================================================
📂 Loading 100 files for problem 139
  Loaded 20/100 files...
  Loaded 40/100 files...
  Loaded 60/100 files...
  Loaded 80/100 files...
  Loaded 100/100 files...
✅ Loaded 100000 total trajectories for problem 139
🔄 Processing 100000 trajectories...
Analyzing trajectories:   0%|          | 0/100000 [00:00<?, ?it/s]Analyzing trajectories:  14%|█▁        | 14306/100000 [00:00<00:00, 143044.45it/s]Analyzing trajectories:  30%|██▉       | 29951/100000 [00:00<00:00, 150919.64it/s]Analyzing trajectories:  45%|████▌     | 45139/100000 [00:00<00:00, 151353.92it/s]Analyzing trajectories:  61%|██████    | 60956/100000 [00:00<00:00, 154040.83it/s]Analyzing trajectories:  77%|███████▋  | 77070/100000 [00:00<00:00, 156597.40it/s]Analyzing trajectories:  93%|█████████▁| 92730/100000 [00:00<00:00, 155687.56it/s]Analyzing trajectories: 100%|██████████| 100000/100000 [00:00<00:00, 154450.61it/s]

 Analyzing Problem 149
==================================================
📂 Loading 100 files for problem 149
  Loaded 20/100 files...
  Loaded 40/100 files...
  Loaded 60/100 files...
  Loaded 80/100 files...
  Loaded 100/100 files...
✅ Loaded 100000 total trajectories for problem 149
🔄 Processing 100000 trajectories...
Analyzing trajectories:   0%|          | 0/100000 [00:00<?, ?it/s]Analyzing trajectories:  16%|█▌        | 16057/100000 [00:00<00:00, 160556.76it/s]Analyzing trajectories:  34%|███▁      | 34075/100000 [00:00<00:00, 172092.30it/s]Analyzing trajectories:  51%|█████▁    | 51495/100000 [00:00<00:00, 173046.66it/s]Analyzing trajectories:  69%|██████▉   | 68964/100000 [00:00<00:00, 173687.45it/s]Analyzing trajectories:  87%|████████▋ | 86705/100000 [00:00<00:00, 175024.39it/s]Analyzing trajectories: 100%|██████████| 100000/100000 [00:00<00:00, 172926.40it/s]

 Analyzing Problem 154
==================================================
📂 Loading 100 files for problem 154
  Loaded 20/100 files...
  Loaded 40/100 files...
  Loaded 60/100 files...
  Loaded 80/100 files...
  Loaded 100/100 files...
✅ Loaded 100000 total trajectories for problem 154
🔄 Processing 100000 trajectories...
Analyzing trajectories:   0%|          | 0/100000 [00:00<?, ?it/s]Analyzing trajectories:  19%|█▊        | 18618/100000 [00:00<00:00, 186170.41it/s]Analyzing trajectories:  39%|███▉      | 39119/100000 [00:00<00:00, 197238.29it/s]Analyzing trajectories:  60%|█████▉    | 59627/100000 [00:00<00:00, 200814.52it/s]Analyzing trajectories:  80%|████████  | 80097/100000 [00:00<00:00, 202341.62it/s]Analyzing trajectories: 100%|██████████| 100000/100000 [00:00<00:00, 201477.88it/s]

 Analyzing Problem 178
==================================================
📂 Loading 100 files for problem 178
  Loaded 20/100 files...
  Loaded 40/100 files...
  Loaded 60/100 files...
  Loaded 80/100 files...
  Loaded 100/100 files...
✅ Loaded 100000 total trajectories for problem 178
🔄 Processing 100000 trajectories...
Analyzing trajectories:   0%|          | 0/100000 [00:00<?, ?it/s]Analyzing trajectories:  15%|█▁        | 14912/100000 [00:00<00:00, 149109.12it/s]Analyzing trajectories:  30%|███       | 30102/100000 [00:00<00:00, 150745.14it/s]Analyzing trajectories:  46%|████▌     | 45782/100000 [00:00<00:00, 153503.37it/s]Analyzing trajectories:  62%|██████▁   | 61559/100000 [00:00<00:00, 155184.26it/s]Analyzing trajectories:  78%|███████▊  | 77665/100000 [00:00<00:00, 157300.75it/s]Analyzing trajectories:  94%|█████████▁| 94074/100000 [00:00<00:00, 159606.74it/s]Analyzing trajectories: 100%|██████████| 100000/100000 [00:00<00:00, 157203.85it/s]

 Analyzing Problem 240
==================================================
📂 Loading 100 files for problem 240
  Loaded 20/100 files...
  Loaded 40/100 files...
  Loaded 60/100 files...
  Loaded 80/100 files...
  Loaded 100/100 files...
✅ Loaded 100000 total trajectories for problem 240
🔄 Processing 100000 trajectories...
Analyzing trajectories:   0%|          | 0/100000 [00:00<?, ?it/s]Analyzing trajectories:   9%|▉         | 8956/100000 [00:00<00:01, 89552.83it/s]Analyzing trajectories:  19%|█▉        | 19427/100000 [00:00<00:00, 98464.71it/s]Analyzing trajectories:  30%|███       | 30203/100000 [00:00<00:00, 102703.76it/s]Analyzing trajectories:  41%|████▁     | 41446/100000 [00:00<00:00, 106540.99it/s]Analyzing trajectories:  53%|█████▁    | 52913/100000 [00:00<00:00, 109470.38it/s]Analyzing trajectories:  64%|██████▁   | 64352/100000 [00:00<00:00, 111137.80it/s]Analyzing trajectories:  77%|███████▋  | 76588/100000 [00:00<00:00, 114804.18it/s]Analyzing trajectories:  89%|████████▉ | 89207/100000 [00:00<00:00, 118425.30it/s]Analyzing trajectories: 100%|██████████| 100000/100000 [00:00<00:00, 113165.17it/s]

 Analyzing Problem 379
==================================================
📂 Loading 100 files for problem 379
  Loaded 20/100 files...
  Loaded 40/100 files...
  Loaded 60/100 files...
  Loaded 80/100 files...
  Loaded 100/100 files...
✅ Loaded 100000 total trajectories for problem 379
🔄 Processing 100000 trajectories...
Analyzing trajectories:   0%|          | 0/100000 [00:00<?, ?it/s]Analyzing trajectories:   9%|▉         | 8775/100000 [00:00<00:01, 87743.18it/s]Analyzing trajectories:  19%|█▉        | 19481/100000 [00:00<00:00, 99098.48it/s]Analyzing trajectories:  31%|███       | 30540/100000 [00:00<00:00, 104342.66it/s]Analyzing trajectories:  42%|████▁     | 41869/100000 [00:00<00:00, 107870.46it/s]Analyzing trajectories:  54%|█████▁    | 53716/100000 [00:00<00:00, 111689.19it/s]Analyzing trajectories:  66%|██████▌   | 65757/100000 [00:00<00:00, 114650.42it/s]Analyzing trajectories:  78%|███████▊  | 78005/100000 [00:00<00:00, 117207.78it/s]Analyzing trajectories:  91%|█████████ | 90822/100000 [00:00<00:00, 120695.01it/s]Analyzing trajectories: 100%|██████████| 100000/100000 [00:00<00:00, 115181.30it/s]

================================================================================
📋 DISCREPANCY ANALYSIS SUMMARY
================================================================================
Problem  86: 100000 total | reward>0 but no_correct: 6857 | reward=0 but has_correct:    0
Problem 139: 100000 total | reward>0 but no_correct: 6811 | reward=0 but has_correct:    0
Problem 149: 100000 total | reward>0 but no_correct:    0 | reward=0 but has_correct:    0
Problem 154: 100000 total | reward>0 but no_correct:    0 | reward=0 but has_correct:    0
Problem 178: 100000 total | reward>0 but no_correct: 4718 | reward=0 but has_correct:    0
Problem 240: 100000 total | reward>0 but no_correct: 25156 | reward=0 but has_correct:    0
Problem 379: 100000 total | reward>0 but no_correct:    0 | reward=0 but has_correct:    0

==================================================
TOTAL ACROSS ALL PROBLEMS:
  Total trajectories analyzed: 700,000
  Reward > 0 but no correct state: 43,542 (6.22%)
  Reward = 0 but has correct state: 0 (0.00%)

================================================================================
 EXAMPLE DISCREPANCIES
================================================================================

Problem 86 - Reward > 0 but no correct state:
  Example 1: Traj 5, Reward: 26.15, Actions: [0, 1, 1, 2, 1, 0, 3, 3, 3, 0], is_correct values: [[0], [0], [0], [0], [0], [0], [0], [0], [0], [0], [0]]
  Example 2: Traj 13, Reward: 26.15, Actions: [2, 0, 3, 0, 0, 3, 1, 1, 2, 1], is_correct values: [[0], [0], [0], [0], [0], [0], [0], [0], [0], [0], [0]]
  Example 3: Traj 22, Reward: 26.15, Actions: [2, 0, 3, 0, 3, 0, 0, 0, 1, 2], is_correct values: [[0], [0], [0], [0], [0], [0], [0], [0], [0], [0], [0]]

Problem 139 - Reward > 0 but no correct state:
  Example 1: Traj 22, Reward: 26.15, Actions: [3, 0, 3, 2, 3, 0, 0, 0, 2, 3], is_correct values: [[0], [0], [0], [0], [0], [0], [0], [0], [0], [0], [0]]
  Example 2: Traj 43, Reward: 26.15, Actions: [0, 1, 1, 2, 1, 0, 0, 0, 1, 2], is_correct values: [[0], [0], [0], [0], [0], [0], [0], [0], [0], [0], [0]]
  Example 3: Traj 54, Reward: 26.15, Actions: [2, 0, 0, 0, 3, 3, 1, 0, 2, 0], is_correct values: [[0], [0], [0], [0], [0], [0], [0], [0], [0], [0], [0]]

Problem 178 - Reward > 0 but no correct state:
  Example 1: Traj 30, Reward: 26.15, Actions: [0, 3, 0, 0, 3, 0, 3, 0, 0, 0], is_correct values: [[0], [0], [0], [0], [0], [0], [0], [0], [0], [0], [0]]
  Example 2: Traj 58, Reward: 26.15, Actions: [2, 3, 2, 0, 0, 3, 3, 0, 2, 2], is_correct values: [[0], [0], [0], [0], [0], [0], [0], [0], [0], [0], [0]]
  Example 3: Traj 81, Reward: 26.15, Actions: [0, 3, 2, 0, 2, 3, 3, 0, 3, 3], is_correct values: [[0], [0], [0], [0], [0], [0], [0], [0], [0], [0], [0]]

Problem 240 - Reward > 0 but no correct state:
  Example 1: Traj 4, Reward: 26.15, Actions: [1, 0, 1, 3, 1, 3, 2, 0, 1, 0], is_correct values: [[0], [0], [0], [0], [0], [0], [0], [0], [0], [0], [0]]
  Example 2: Traj 5, Reward: 26.15, Actions: [0, 0, 0, 3, 3, 0, 3, 0, 1, 1], is_correct values: [[0], [0], [0], [0], [0], [0], [0], [0], [0], [0], [0]]
  Example 3: Traj 11, Reward: 26.15, Actions: [2, 0, 3, 2, 2, 1, 0, 1, 1, 2], is_correct values: [[0], [0], [0], [0], [0], [0], [0], [0], [0], [0], [0]]

✅ Detailed analysis saved to: /home/ubuntu/GFN_to_ARC/gfn/analysis/reward_vs_correctness_analysis.json
